CATEGORY|Fragrant|fruity|floral, mikaven, apetiziran, aromatičen, prijeten, okusen, očarljiv, aromatiziran, aromatičen, cvetlični, cvetoč, dišeč, saden, okusen, mošusen, plesen, okusen, okusen
CATEGORY|woody/earthy/mouldy, kamforasti, stoletni, vlažni, mokri, prašni, zemeljski, deževni, smolnati, vlažni, mahoviti, travnati, zeliščni, vlažni, zastareli, premalo sezonski, leseni
CATEGORY|chemical|hydro-carbons|synthetic, alkoholna, alkalna, antiseptična, kemična, zdravilna
CATEGORY|fresh,cool, slan, osvežujoč, svež, svež, metin
CATEGORY|sweet|spicy, karameliziran, kloniranje, pikant, saharin, fiziološka raztopina, slano, slano, polsladko, poper, pikantnost, začinjeno, sladko, sladko, sladko, sladko diši, sirupasto, pikantno, pretresljivo
CATEGORY|smoky|toasted|burnt|fatty, pekoč, zažgan, sirast, maščoben, dimljen, dimljen, oreškov
CATEGORY|decayed, upognjen, ribič, napačen, gnilo, žarko, gnilo, česen, stagnira
CATEGORY|pungent, trpko, kislo, trpko, grenko, grenko sladko, smrdljivo, blato, fekalno, ostro, ostro, kislo, prepoteno, vihravo