CATEGORY|emissions_traffic|fuel|dust, asfalto, automobile, autobus, bus, macchina, prodotti chimici, cloro, polvere, tubo di scappamento, carburante, esalazioni, benzina, grasso, lubrificante, foschia, nebbia, lino, camion , petrolio, smog, fumo, traffico, tram
CATEGORY|industry, bulldozer, canna fumaria, camino, carbone, diesel, tubi di scarico, fabbrica, malta, intonaco, ferro, metallo, ruggine, liquami, fognatura, fogna, ciminiera, vapore
CATEGORY|food|beverage, macello, mandorla, anice, mela, torta alle mele, rucola, cibo cinese, avocado, bacon, pancetta, prodotti da forno, panetteria, baklava, banana, barbecue, basilico, bbq, birra, biscotto, amaro, miscela, alcolici, brandy, pane , brownie, macellaio , toffee, cavolo, caffetteria, torta , caramello, cardamomo, cardamomo, cedro, chabli, formaggio, ciliegia, pollo, chipotle, cioccolato, cannella, agrume, caffè, coca cola, condimento, biscotto, mais, cous cous, crema, crepe, cetriolo, cucina, caseificio, prodotto caseario, impasto, earl grey, uova, falafel, pesce, carne, cibo , mercato alimentare, patatine fritte, pane fresco, caffè fresco, pesce fresco, frutta, torta alla frutta, crema ganache, aglio, aglio, uva, grasso, lubrificante, semola, raccolto, pasticcio di carne, aringa, miele, hot dog, gelato, cibo indiano, jalapeno, porro, avanzi, limone, liquirizia, lime, macadamia, marshmallow, maionese, carne, melone, tortina natalizia, moussaka, fungo, mostarda, farina d'avena, olio, omelette, cipolla, succo d'arancia, cibo orientale, forno, forno, ozono, pancake, pasticceria, pera, pepe, menta piperita, pizza, patata, uvetta, lampone, salsa ai sottaceti, zafferano, sale, sandwich, salsiccia, sauvignon , capasanta, frutti di mare, sorbetto, sherry, spiedo, snack, snapper (tipo di pesce), soda, zuppa, latte scaduto, inacidito, spam, spezie, cibo speziato, bistecca, fragola, sushi, caramella, taco, crostata, tè, tiramisu, topping, vaniglia, ortaggi, aceto, wafer, waffle, crescione, vino, patata dolce, lievito
CATEGORY|tobacco|smoke, sigaro, sigaretta, incenso, marijuana, fumo, fumatore, tabacco
CATEGORY|cleaning|medicinal, alcool, ammoniaca, benda, candeggina, addetto alle pulizie, pulizie, vestiti, colonia, dentista, colla, eroina, stirare, mutandine, bucato, naftalina, vernice, resina, solvente, vernice spray, solfuro, mutande
CATEGORY|synthetic, lattice, pelle, gomma, camoscio, pneumatico, pneumatico
CATEGORY|waste_garbage|pee|vomit|excrement|rotten, bile, fiel, cestino, cadavere, cacca di cane, escremento, feci, peto, feci, spazzatura, immondizia, camion dell'immondizia, lettiera, spazzatura, letame, letame, pipì, piscio, bagno pubblico, frutta marcia, calzini usati, spazzatura, immondizia, merda, acido, toilette, spazzatura, immondizia, orrinatoio, urina, vomito, rifiuti
CATEGORY|animal|people, animale, fienile, granaio, beagle, corpo, toro, cervo, sporco, vestiti sporchi, cagnolino, felino, aria fresca, rana, mandria, cavallo, fango, paraffina, roditore, puzzola, sudore, lupo, zoo
CATEGORY|nature_flowers|plant|tree|soil, ambra, fioritura, fioritura, bocciolo, fioritura, mazzo di fiori, cedro, legno di cedro, crisantemo, argilla, conifera, giunchiglia, umidità, fiori secchi, erba secca, terra, eucalipto, eucalipto, fiore, negozio di fiori, fioraio, fragranza, capra, erba , pavimento, gomma, fieno, erbe, edera, gelsomino, lavanda, lavanda, prato rasato, foglie, giglio, giglio, magnolia, medicinali, umido, muschio, legno vecchio, profumo, pino, pino, pianta, erba (da fumare), potpourri, rosa, rosmarino, salvia, legno di sandalo, alga, suolo, pietra, solfuro, sicomoro, albero, tulipano, violetta, erba (da fumare), alga, foglia bagnata, legno, legno, bosco
