CATEGORY|emissions_traffic|fuel|dust, Asphalt, Automobil, Bus, Busse, Wagen, Auto, Autos, Chemikalien, Chlor, Staub, Auspuff, Treibstoff, Rauch, Dämpfe, Benzin, Gasolin, Fett, Dunst, Lastwagen, Öle, Benzin, Smog, Rauch, Verkehr, Straßenbahn, Straßenbahnen
CATEGORY|industry, Bulldozer, Kamin, Kohle, Kohlen, Diesel-, Abflüsse, Fabrik, Mörtel, Eisen, Metall, Rost, Abwasser, Kanal, Kanalisation, Schornstein, Dampf
CATEGORY|food|beverage, Schlachthof, Schlachthöfe, Mandel, Mandeln, Anis, Apfel, Apfelkuchen, Apfelkuchen, Rucola, asiatisches Essen, Avocado, Speck, Backwaren, Bäckerei, Baklava, Banane, Grill, Basilikum, Grill, Bier, Biere, Keks, Kekse, bitter, Mischung, alkoholische Getränke, Brandy, Brot, Brownie, Diener, Butterscotch, Kohl, Cafe, Kuchen, Karamell, Kardamom, Kardamom, Zeder, Chabli, Käse, Kirsche, Hähnchen, Chipotle, Schokolade, Zimt, Zitrusfrüchte, Kaffee, Cola, Würze, Plätzchen, Mais, Couscous, Creme, Krepp, Gurke, Küche, Molkerei, Teig, Earl Grey, Ei, Falafel, Fisch, Fleisch, Lebensmittel, Supermarkt, Pommes frittes, frisches Brot, frischer Kaffee, frischer Fisch, Obst, Obstkuchen, Fudge, Knoblauch, Knoblauch, Traube, Fett, Grütze, Ernte, Hering, Honig, Hotdog, Eiscreme, Indisches Essen, Jalapeno, Lauch, Reste, Zitrone, Lakritze, Limette, Macadamia, Mäusespeck, Mayonnaise, Fleisch, Melone, Hackfleischpastete, Moussaka, Pilz, Senf, Haferflocken, Öl, Omelett, Omelette, Zwiebel, Orangensaft, orientalisches Essen, Ofen, Ofen, Ozon, Pfannkuchen, Gebäck, Birne, Pfeffer, Pfefferminze, Pizza, Kartoffel, Rosine, Himbeere, genießen, Safran, Salz, Sandwich, Würstchen, Sauvignon, Jakobsmuschel, Meeresfrüchte, Sorbett, Sherry, Spieß, Snack, Schnapper, Sprudel, Suppe, saure Milch, Spam, würzen, Gewürze, scharfes Essen, Steak, Erdbeere, Sushi, Süss, Taco, Torte, Tee, Tiramisu, Belag, Vanille, Gemüse, Essig, Wafer, Waffel, Brunnenkresse, Wein, Süßkartoffel, Hefe
CATEGORY|tobacco|smoke, Zigarre, Zigarette, Weihrauch, Marihuana, Rauch, Raucher, rauchig, rauchig, Tabak, Tabak
CATEGORY|cleaning|medicinal, Alkohol, Ammoniak, Band, bleichen, Reiniger, Reinigung, Kleider, Eau de Cologne, Zahnarzt, kleben, Heroin, Bügeln, Unterhose, Wäsche, Mottenkugel, Farbe, Harz, Lösungsmittel, Sprühfarbe, Sulfid, Unterwäsche
CATEGORY|synthetic, Latex, Leder, Gummi, Wildleder, Reifen, Reifen
CATEGORY|waste_garbage|pee|vomit|excrement|rotten, Galle, Behälter, Leiche, Hundescheiße, Kot, Kot, Furz, Kot, Müll, Müllwagen, Abfall, Dünger, Düngemittel, pinkeln, Piss, öffentliche Toilette, verdorbenes Obst, faule Socken, Müll, Scheisse, sauer, Toilette, Müll, Urinal, Urin, erbrechen, Abfall, kotzen, übergeben, Kotze
CATEGORY|animal|people, Tier, Scheune, Beagle, Körper, Stier, Hirsch, Schmutz, dreckige Kleidung, Hund, katzenartig, frische Luft, Frosch, Herde, Pferd, Schlamm, Ozelot, Paraffin, Nagetier, Stinktier, Schweiß, Vetiver, Wolf, Zoo, Bulle, Katze
CATEGORY|nature_flowers|plant|tree|soil, Bernstein, blühen, Blühen, Blüte, blühen, Strauß, Zeder, Zedernholz, Chrysantheme, Lehm, Nadelbaum, Narzisse, Feuchtigkeit, trockene Blumen, trockenes Gras, Erde, Eukalyptus, Eukalyptus, Blume, Blumengeschäft, Duft, Ziege, Gras, Boden, Gummi, Heu, Kraut, Efeu, Jasmin, Lavendel, Lavendel, Rasen, Blätter, Lilie, Lilie, Magnolie, medizinisch, feucht, Moschus, altes Holz, Parfüm, Kiefer, Pinie, Pflanze, Topf, Potpourri, pudrig, Rose, Rosmarin, Salbei, Sandelholz, Seetang, Boden, Stein, Schwefel, Bergahorn, Baum, Tulpe, violett, Gras, nasses Blatt, Holz, Holz, Wälder, Blütenpracht